
    =========================== USB Port3 ===========================

Connection Status        : 0x01 (Device is connected)
Port Chain               : 1-3
Properties               : 0x01
 IsUserConnectable       : yes
 PortIsDebugCapable      : no
 PortHasMultiCompanions  : no
 PortConnectorIsTypeC    : no
ConnectionIndex          : 0x03 (Port 3)
CompanionIndex           : 0
 CompanionHubSymLnk      : USB#ROOT_HUB30#4&3b1f23e2&0&0#{f18a0e88-c30c-11d0-8815-00a0c906bed8}
 CompanionPortNumber     : 0x0F (Port 15)
 -> CompanionPortChain   : 1-15

      ========================== Summary =========================
Vendor ID                : 0x413C (Dell Inc.)
Product ID               : 0x4503
Manufacturer String      : "Dell Computer Corp"
Product String           : "Dell Universal Receiver"
Serial                   : ---
USB Version              : 2.0 (but 12 Mbit/s FullSpeed only)
Port maximum Speed       : High-Speed (Companion Port 1-15 is doing the SuperSpeed)
Device maximum Speed     : Full-Speed
Device Connection Speed  : Full-Speed
Self powered             : no
Demanded Current         : 100 mA
Used Endpoints           : 4

      ======================== USB Device ========================

        +++++++++++++++++ Device Information ++++++++++++++++++
Device Description       : USB Composite Device
BusReported Device Desc  : Dell Universal Receiver
Device Path              : \\?\USB#VID_413C&PID_4503#5&128cf644&0&3#{a5dcbf10-6530-11d2-901f-00c04fb951ed} (GUID_DEVINTERFACE_USB_DEVICE)
Kernel Name              : \Device\USBPDO-5
Device ID                : USB\VID_413C&PID_4503\5&128CF644&0&3
Hardware IDs             : USB\VID_413C&PID_4503&REV_0240 USB\VID_413C&PID_4503
Driver KeyName           : {36fc9e60-c465-11cf-8056-444553540000}\0008 (GUID_DEVCLASS_USB)
Driver                   : \SystemRoot\System32\drivers\usbccgp.sys (Version: 10.0.26100.9444  Date: 2026-09-26  Company: Microsoft Corporation)
Driver Inf               : C:\WINDOWS\inf\usb.inf
Legacy BusType           : PNPBus
Class                    : USB
Class GUID               : {36fc9e60-c465-11cf-8056-444553540000} (GUID_DEVCLASS_USB)
Service                  : usbccgp
Enumerator               : USB
Location Info            : Port_#0003.Hub_#0002
Address                  : 3
Location IDs             : PCIROOT(0)#PCI(1400)#USBROOT(0)#USB(3), ACPI(_SB_)#ACPI(PC00)#ACPI(XHCI)#ACPI(RHUB)#ACPI(HS03)
Container ID             : {628a71f1-bfdc-11f1-8e6d-a8b13b145df9}
Manufacturer Info        : (Standard USB Host Controller)
Capabilities             : 0x84 (Removable, SurpriseRemovalOK)
Status                   : 0x0180400A (DN_DRIVER_LOADED, DN_STARTED, DN_REMOVABLE, DN_NT_ENUMERATOR, DN_NT_DRIVER)
Lower Filters            : DPMDriver
First Install Date       : 2026-10-04 15:45:48
Last Arrival Date        : 2026-10-05 08:54:06
EnhancedPowerMgmtEnabled : 0
Power State              : D0 (supported: D0, D1, D2, D3, wake from D0, wake from D1, wake from D2)

        +++++++++++++++++ Registry USB Flags +++++++++++++++++
HKEY_LOCAL_MACHINE\SYSTEM\CurrentControlSet\Control\usbflags\413C45030240
 osvc                    : REG_BINARY 00 00

        ---------------- Connection Information ---------------
Connection Index         : 0x03 (Port 3)
Connection Status        : 0x01 (DeviceConnected)
Current Config Value     : 0x01 (Configuration 1)
Device Address           : 0x0C (12)
Is Hub                   : 0x00 (no)
Device Bus Speed         : 0x01 (Full-Speed)
Number of open Pipes     : 0x03 (3 pipes to data endpoints)
Pipe[0]                  : EndpointID=1  Direction=IN   ScheduleOffset=0  Type=Interrupt  wMaxPacketSize=0x08    bInterval=4   -> 196 Bits/ms = 24500 Bytes/s
Pipe[1]                  : EndpointID=2  Direction=IN   ScheduleOffset=0  Type=Interrupt  wMaxPacketSize=0x08    bInterval=2   -> 196 Bits/ms = 24500 Bytes/s
Pipe[2]                  : EndpointID=3  Direction=IN   ScheduleOffset=0  Type=Interrupt  wMaxPacketSize=0x20    bInterval=2   -> 420 Bits/ms = 52500 Bytes/s

        --------------- Connection Information V2 -------------
Connection Index         : 0x03 (3)
Length                   : 0x10 (16 bytes)
SupportedUsbProtocols    : 0x03
 Usb110                  : 1 (yes, port supports USB 1.1)
 Usb200                  : 1 (yes, port supports USB 2.0)
 Usb300                  : 0 (no, port not supports USB 3.0) -> but Companion Port 1-15 does
 ReservedMBZ             : 0x00
Flags                    : 0x00
 DevIsOpAtSsOrHigher     : 0 (Device is not operating at SuperSpeed or higher)
 DevIsSsCapOrHigher      : 0 (Device is not SuperSpeed capable or higher)
 DevIsOpAtSsPlusOrHigher : 0 (Device is not operating at SuperSpeedPlus or higher)
 DevIsSsPlusCapOrHigher  : 0 (Device is not SuperSpeedPlus capable or higher)
 ReservedMBZ             : 0x00

    ---------------------- Device Descriptor ----------------------
bLength                  : 0x12 (18 bytes)
bDescriptorType          : 0x01 (Device Descriptor)
bcdUSB                   : 0x200 (USB Version 2.0) -> but device is Full-Speed only
bDeviceClass             : 0x00 (defined by the interface descriptors)
bDeviceSubClass          : 0x00
bDeviceProtocol          : 0x00
bMaxPacketSize0          : 0x20 (32 bytes)
idVendor                 : 0x413C (Dell Inc.)
idProduct                : 0x4503
bcdDevice                : 0x0240
iManufacturer            : 0x01 (String Descriptor 1)
 Language 0x0409         : "Dell Computer Corp"
iProduct                 : 0x02 (String Descriptor 2)
 Language 0x0409         : "Dell Universal Receiver"
iSerialNumber            : 0x00 (No String Descriptor)
bNumConfigurations       : 0x01 (1 Configuration)

    ------------------ Configuration Descriptor -------------------
bLength                  : 0x09 (9 bytes)
bDescriptorType          : 0x02 (Configuration Descriptor)
wTotalLength             : 0x0054 (84 bytes)
bNumInterfaces           : 0x03 (3 Interfaces)
bConfigurationValue      : 0x01 (Configuration 1)
iConfiguration           : 0x00 (No String Descriptor)
bmAttributes             : 0xA0
 D7: Reserved, set 1     : 0x01
 D6: Self Powered        : 0x00 (no)
 D5: Remote Wakeup       : 0x01 (yes)
 D4..0: Reserved, set 0  : 0x00
MaxPower                 : 0x32 (100 mA)

        ---------------- Interface Descriptor -----------------
bLength                  : 0x09 (9 bytes)
bDescriptorType          : 0x04 (Interface Descriptor)
bInterfaceNumber         : 0x00 (Interface 0)
bAlternateSetting        : 0x00
bNumEndpoints            : 0x01 (1 Endpoint)
bInterfaceClass          : 0x03 (HID - Human Interface Device)
bInterfaceSubClass       : 0x01 (Boot Interface)
bInterfaceProtocol       : 0x01 (Keyboard)
iInterface               : 0x00 (No String Descriptor)

        ------------------- HID Descriptor --------------------
bLength                  : 0x09 (9 bytes)
bDescriptorType          : 0x21 (HID Descriptor)
bcdHID                   : 0x0111 (HID Version 1.11)
bCountryCode             : 0x00 (00 = not localized)
bNumDescriptors          : 0x01
Descriptor 1:
bDescriptorType          : 0x22 (Class=Report)
wDescriptorLength        : 0x003B (59 bytes)
  05 01             Usage Page (Generic Desktop Controls)
  09 06             Usage (Keyboard)
  A1 01             Collection (Application)
  95 08               Report Count (8)
  75 01               Report Size (1)
  15 00               Logical Minimum (0)
  25 01               Logical Maximum (1)
  05 07               Usage Page (Keyboard)
  19 E0               Usage Minimum (224)
  29 E7               Usage Maximum (231)
  81 02               Input (Var)
  81 03               Input (Const, Var)
  95 05               Report Count (5)
  05 08               Usage Page (LEDs)
  19 01               Usage Minimum (1)
  29 05               Usage Maximum (5)
  91 02               Output (Var)
  95 01               Report Count (1)
  75 03               Report Size (3)
  91 01               Output (Const)
  95 06               Report Count (6)
  75 08               Report Size (8)
  15 00               Logical Minimum (0)
  26 FF 00            Logical Maximum (255)
  05 07               Usage Page (Keyboard)
  19 00               Usage Minimum (0)
  2A FF 00            Usage Maximum (255)
  81 00               Input ()
  C0                End Collection

        ----------------- Endpoint Descriptor -----------------
bLength                  : 0x07 (7 bytes)
bDescriptorType          : 0x05 (Endpoint Descriptor)
bEndpointAddress         : 0x81 (Direction=IN EndpointID=1)
bmAttributes             : 0x03 (TransferType=Interrupt)
wMaxPacketSize           : 0x0008 (8 bytes)
bInterval                : 0x04 (4 ms)

        ---------------- Interface Descriptor -----------------
bLength                  : 0x09 (9 bytes)
bDescriptorType          : 0x04 (Interface Descriptor)
bInterfaceNumber         : 0x01 (Interface 1)
bAlternateSetting        : 0x00
bNumEndpoints            : 0x01 (1 Endpoint)
bInterfaceClass          : 0x03 (HID - Human Interface Device)
bInterfaceSubClass       : 0x01 (Boot Interface)
bInterfaceProtocol       : 0x02 (Mouse)
iInterface               : 0x00 (No String Descriptor)

        ------------------- HID Descriptor --------------------
bLength                  : 0x09 (9 bytes)
bDescriptorType          : 0x21 (HID Descriptor)
bcdHID                   : 0x0111 (HID Version 1.11)
bCountryCode             : 0x00 (00 = not localized)
bNumDescriptors          : 0x01
Descriptor 1:
bDescriptorType          : 0x22 (Class=Report)
wDescriptorLength        : 0x007F (127 bytes)
  05 01             Usage Page (Generic Desktop Controls)
  09 02             Usage (Mouse)
  A1 01             Collection (Application)
  85 01               Report ID (0x01)
  09 01               Usage (Pointer)
  A1 00               Collection (Physical)
  05 09                 Usage Page (Buttons)
  19 01                 Usage Minimum (1)
  29 05                 Usage Maximum (5)
  15 00                 Logical Minimum (0)
  25 01                 Logical Maximum (1)
  95 05                 Report Count (5)
  75 01                 Report Size (1)
  81 02                 Input (Var)
  95 01                 Report Count (1)
  75 03                 Report Size (3)
  81 01                 Input (Const)
  95 02                 Report Count (2)
  75 0C                 Report Size (12)
  16 01 F8              Logical Minimum (-2047)
  26 FF 07              Logical Maximum (+2047)
  05 01                 Usage Page (Generic Desktop Controls)
  09 30                 Usage (Direction-X)
  09 31                 Usage (Direction-Y)
  81 06                 Input (Var, Rel)
  95 01                 Report Count (1)
  75 08                 Report Size (8)
  15 81                 Logical Minimum (-127)
  25 7F                 Logical Maximum (+127)
  09 38                 Usage (Wheel)
  81 06                 Input (Var, Rel)
  95 01                 Report Count (1)
  05 0C                 Usage Page (Consumer)
  0A 38 02              Usage (AC Pan)
  81 06                 Input (Var, Rel)
  C0                  End Collection
  C0                End Collection
  05 0C             Usage Page (Consumer)
  09 01             Usage (Consumer Control)
  A1 01             Collection (Application)
  85 03               Report ID (0x03)
  95 01               Report Count (1)
  75 10               Report Size (16)
  15 01               Logical Minimum (1)
  26 FF 02            Logical Maximum (767)
  19 01               Usage Minimum (1)
  2A FF 02            Usage Maximum (767)
  81 00               Input ()
  C0                End Collection
  05 01             Usage Page (Generic Desktop Controls)
  09 80             Usage (System Control)
  A1 01             Collection (Application)
  85 04               Report ID (0x04)
  19 81               Usage Minimum (129)
  29 83               Usage Maximum (131)
  15 00               Logical Minimum (0)
  25 01               Logical Maximum (1)
  75 01               Report Size (1)
  95 03               Report Count (3)
  81 02               Input (Var)
  95 05               Report Count (5)
  81 01               Input (Const)
  C0                End Collection

        ----------------- Endpoint Descriptor -----------------
bLength                  : 0x07 (7 bytes)
bDescriptorType          : 0x05 (Endpoint Descriptor)
bEndpointAddress         : 0x82 (Direction=IN EndpointID=2)
bmAttributes             : 0x03 (TransferType=Interrupt)
wMaxPacketSize           : 0x0008 (8 bytes)
bInterval                : 0x02 (2 ms)

        ---------------- Interface Descriptor -----------------
bLength                  : 0x09 (9 bytes)
bDescriptorType          : 0x04 (Interface Descriptor)
bInterfaceNumber         : 0x02 (Interface 2)
bAlternateSetting        : 0x00
bNumEndpoints            : 0x01 (1 Endpoint)
bInterfaceClass          : 0x03 (HID - Human Interface Device)
bInterfaceSubClass       : 0x00 (None)
bInterfaceProtocol       : 0x00 (None)
iInterface               : 0x00 (No String Descriptor)

        ------------------- HID Descriptor --------------------
bLength                  : 0x09 (9 bytes)
bDescriptorType          : 0x21 (HID Descriptor)
bcdHID                   : 0x0111 (HID Version 1.11)
bCountryCode             : 0x00 (00 = not localized)
bNumDescriptors          : 0x01
Descriptor 1:
bDescriptorType          : 0x22 (Class=Report)
wDescriptorLength        : 0x002F (47 bytes)
  06 00 FF          Usage Page (Vendor Defined)
  09 00             Usage (unknown)
  A1 01             Collection (Application)
  85 01               Report ID (0x01)
  09 00               Usage (unknown)
  15 00               Logical Minimum (0)
  26 FF 00            Logical Maximum (255)
  75 08               Report Size (8)
  95 1F               Report Count (31)
  82 02 01            Input (Var, BuffBytes)
  C0                End Collection
  06 01 FF          Usage Page (Vendor Defined)
  09 01             Usage (unknown)
  A1 01             Collection (Application)
  85 08               Report ID (0x08)
  95 1F               Report Count (31)
  75 08               Report Size (8)
  15 00               Logical Minimum (0)
  26 FF 00            Logical Maximum (255)
  09 20               Usage (unknown)
  B1 03               Feature (Const, Var)
  C0                End Collection

        ----------------- Endpoint Descriptor -----------------
bLength                  : 0x07 (7 bytes)
bDescriptorType          : 0x05 (Endpoint Descriptor)
bEndpointAddress         : 0x83 (Direction=IN EndpointID=3)
bmAttributes             : 0x03 (TransferType=Interrupt)
wMaxPacketSize           : 0x0020 (32 bytes)
bInterval                : 0x02 (2 ms)

    ----------------- Device Qualifier Descriptor -----------------
Error                    : request skipped because low-speed device

      -------------------- String Descriptors -------------------
             ------ String Descriptor 0 ------
bLength                  : 0x04 (4 bytes)
bDescriptorType          : 0x03 (String Descriptor)
Language ID[0]           : 0x0409 (English - United States)
             ------ String Descriptor 1 ------
bLength                  : 0x26 (38 bytes)
bDescriptorType          : 0x03 (String Descriptor)
Language 0x0409          : "Dell Computer Corp"
             ------ String Descriptor 2 ------
bLength                  : 0x30 (48 bytes)
bDescriptorType          : 0x03 (String Descriptor)
Language 0x0409          : "Dell Universal Receiver"
